id	successful	dissovet	speciality	title	author	supervisor	uploaded	defended	interval
480608	True	04.19.00	2.3.4	Метод и модели управления индивидуальными туристическими маршрутами на основе глубоких нейронных сетей	Михайлов Сергей Андреевич	Смирнов Александр Викторович	22.11.2021	24.12.2021	32
243678	True	02.18.00	05.13.17	Исследование и разработка алгоритмов рекомендательных систем на основе информационных моделей динамики пользовательского опыта в сетях предоставления услуг	Деревицкий Иван Владиславович	Бухановский Александр Валерьевич	24.11.2020	24.12.2020	30
49079551	True	09.22.00	2.7.1	Разработка технологии пробиотического мороженого без сахарозы	Тютьков Никита	Бараненко Денис Александрович	03.06.2025	03.07.2025	30
476014	True	02.18.00	05.13.19	Модели, алгоритмы и методика проектирования защищенных от киберфизических атак систем физической безопасности на основе микроконтроллеров	Левшун Дмитрий Сергеевич	Котенко Игорь Витальевич	15.11.2021	15.12.2021	30
1035146	True	04.22.00	2.3.8	Методы и алгоритмы аудиовизуального распознавания эмоционального состояния типично и атипично развивающихся детей	Матвеев Антон Юрьевич	Махныткина Олеся Владимировна	21.11.2023	22.12.2023	31
49162378	True	03.22.00	2.3.1	Настройка параметров регуляторов для нелинейных непрерывных систем на основе алгоритмов оптимизации	Хоанг Дык Лонг	Дударенко Наталия Александровна	25.07.2025	25.08.2025	31
904041	True	03.22.00	2.3.1	Управление по выходу параметрически неопределенным линейным объектом с неучтенной динамикой и возмущающими воздействиями	Громова Фатимат Беслановна	Борисов Олег Игоревич	26.05.2023	26.06.2023	31
229766	True	08.19.00	01.04.14	Фундаментальное уравнение состояния хладагента r1234yf в рамках масштабной теории критической точки	Свердлов Александр Викторович	Рыков Владимир Алексеевич	21.11.2020	23.12.2020	32
18759617	True	04.22.00	2.3.8	Модели и алгоритмы вычислительных процессов для решения трудных вариантов проблемы булевой выполнимости	Павленко Артём Леонидович	Семёнов Александр Анатольевич	22.11.2024	24.12.2024	32
125947	True	05.19.00	01.04.05	Нелинейные топологические эффекты в полупроводниковых оптических микрорезонаторах	Налитов Антон Витальевич	Тиходеев Сергей Григорьевич	26.02.2021	28.04.2021	61
14075899	True	08.22.00	1.3.14	Исследование теплофизических свойств металлокерамических спеченных фрикционных материалов на основе меди	Киляшов Артемий Александрович	Баранов Игорь Владимирович	18.11.2024	19.12.2024	31
917124	True	07.22.00	1.3.11	Синтез непланарных наногетероструктур на основе iii-n полупроводниковых материалов на кремнии методом молекулярно-пучковой эпитаксии и их свойства	Гридчин Владислав Олегович	Цырлин Георгий Эрнстович	29.05.2023	30.06.2023	32
962532	True	05.22.00	1.3.6	Нанокомпозит на основе сульфида мышьяка в пористом стекле: фотоиндуцированные эффекты и влияние наночастиц золота	Альхалил Джордж	Бурункова Юлия Эдуардовна	27.07.2023	30.08.2023	34
1026696	True	05.22.00	1.3.6	Оптические наноантенны для эффективного возбуждения и поглощения электромагнитных волн	Проскурин Алексей Алексеевич	Богданов Андрей Андреевич	13.11.2023	13.12.2023	30
747006	True	09.22.00	2.7.1	Разработка технологии напитка на основе голозерного овса, обогащенного бета-каротином, инкапсулированным в бета-глюкановую матрицу	Ибрахим Моника Набиль Гайед	Баракова Надежда Васильевна	15.11.2022	15.12.2022	30
10311106	True	15.24.00	1.3.6	Высококонтрастные перестраиваемые фотонные структуры на основе материалов с фазовой памятью ge2sb2te5	Соломонов Александр Иванович	Рыбин Михаил Валерьевич	18.11.2024	18.12.2024	30
149844	True	06.19.00	05.11.07	Оптико-электронные методы и средства комплексной оценки распределения яркости в условиях городской среды	Колгушкина Светлана Владимировна	Прокопенко Виктор Трофимович	25.05.2020	08.09.2020	106
14074408	True	16.24.00	1.3.4	Субволновые объемные резонаторы для перераспределения радиочастотного поля в высокопольной магнитно-резонансной томографии	Пучнин Виктор Михайлович	Щелокова Алёна Вадимовна	18.11.2024	18.12.2024	30
129212	True	09.19.00	05.18.07	Технология пшеничного кваса с использованием комбинации дрожжей и молочнокислых бактерий	Алексеева Мария Сергеевна	Баланов Петр Евгеньевич	25.02.2020	27.03.2020	31
1016833	True	05.22.00	1.3.6	Оптические вихри в циркулярных оптических волокнах с изгибными регулярными и вихревыми акустическими модами	Викулин Дмитрий Вячеславович	Яворский Максим Александрович	19.10.2023	22.11.2023	34
1012386	True	06.22.00	2.2.6	Разработка и исследование планапохроматических компактных двухканальных оптических систем с регистрацией изображения для медицинских исследований	Кожина Анастасия Дмитриевна	Цыганок Елена Анатольевна	02.10.2023	02.11.2023	31
454785	True	05.19.00	1.3.6	Оптические силы в поле эванесцентных волн на границе раздела сред	Костина Наталия Алексеевна	Шалин Александр Сергеевич	18.10.2021	18.11.2021	31
460640	True	05.19.00	1.3.6	Исследование оптических и плазмонных свойств гибридных структур на основе углеродных пленок и металлических наночастиц	Аббоуд Мохамед Мостафа Хассаниен Элсаид	Коншина Елена Анатольевна	02.11.2021	07.12.2021	35
739188	True	05.22.00	1.3.6	Взаимодействие лазерного излучения с гибкими металл-органическими каркасами: структурная модификация и нелинейно оптический отклик	Мезенов Юрий Анатольевич	Миличко Валентин Андреевич	23.11.2022	23.12.2022	30
125458	True	05.19.00	01.04.05	Метафотоника на основе резонансных диэлектрических структур	Кившар Юрий	Гиппиус Николай Алексеевич	18.10.2019	20.12.2019	63
178787	True	09.19.00	05.18.07	Применение ультрадисперсных гумато- сапропелевых суспензий в технологии  этилового спирта из ячменя	Нсенгумуремый Даниель	Баракова Надежда Васильевна	03.06.2020	03.07.2020	30
239014	True	06.19.00	05.11.01	Влияние поляризационных преобразований на сдвиг фазы саньяка в волоконно-оптическом гироскопе	Мухтубаев Азамат Булатович	Аксарин Станислав Михайлович	18.11.2020	18.12.2020	30
231152	True	08.19.00	05.04.03	Повышение эффективности испарителей холодильных машин с внутриканальным кипением хладагентов	Куадио Коффи Фабрис	Малышев Александр Александрович	06.11.2020	16.12.2020	40
10314339	True	09.22.00	2.7.1	Научно-практические подходы получения производственных штаммов дрожжей saccharomyces	Давыденко Светлана Геннадьевна	Меледина Татьяна Викторовна	24.10.2024	24.12.2024	61
606884	True	08.19.00	05.04.03	Выбор и обоснование технологии охлаждения многоместной кабины для общего криотерапевтического воздействия	Василенок Анна Владимировна	Баранов Александр Юрьевич	30.05.2022	30.06.2022	31
1026466	True	09.22.00	2.7.1	Разработка технологии синбиотического безалкогольного напитка, обогащенного инулином из корня подсолнечника	Коршунова Наталья Александровна	Баланов Петр Евгеньевич	08.11.2023	08.12.2023	30
238955	True	07.19.00	05.27.03	Полупроводниковые гетероструктуры a3b5, полученные методами молекулярно-пучковой эпитаксии и спекания, и лазеры спектрального диапазона 1300 – 1550 нм на их основе	Карачинский Леонид Яковлевич	Егоров Антон Юрьевич	30.12.2020	03.03.2021	63
126766	True	07.19.00	05.27.03	Геометрические параметры лазерных диодов с пассивной синхронизацией мод спектрального диапазона 1530-1565 нм	Михайловский Григорий Александрович	Одноблюдов Максим Анатольевич	15.11.2019	18.12.2019	33
1018467	True	05.22.00	1.3.6	Влияние фазовых и поляризационных флуктуаций излучения и параметров оптических компонентов на скорость квантового распределения ключей на непрерывных переменных по оптическому волокну	Наседкин Борис Александрович	Егоров Владимир Ильич	26.10.2023	27.11.2023	32
738757	True	05.22.00	1.3.6	Управление мощностью лазерного излучения на основе анализа ик-сигнала, сопровождающего лазерное разрушение биотканей	До Тхань Тунг	Беликов Андрей Вячеславович	11.11.2022	12.12.2022	31
357678	True	02.18.00	05.13.19	Метод и алгоритмы детектирования атак и защиты сетей класса «издатель-подписчик» на основе машинного обучения и инъекции метаданных в сообщения	Дикий Дмитрий Игоревич	Гришенцев Алексей Юрьевич	02.06.2021	02.07.2021	30
742994	True	05.22.00	1.3.6	Особенности определения характеристик имитаторов роговицы глаза на основе кварцевых сфер и реальных биологических тканей желудка человека с помощью излучения в терагерцовом диапазоне частот	Григорьев Роман Олегович	Балбекин Николай Сергеевич	16.11.2022	16.12.2022	30
231348	True	09.19.00	05.18.07	Разработка биотехнологии фитазы с использованием штамма aspergillus niger	Муста Оглы Наргуль	Шарова Наталья Юрьевна	16.11.2020	17.12.2020	31
702176	True	03.22.00	2.3.1	Траекторное управление при неполной информации о параметрах и переменных состояния нелинейной модели движения мобильного робота	Хоанг Дык Тхинь	Пыркин Антон Александрович	06.09.2022	06.10.2022	30
1030046	True	14.22.00	2.3.6	Методы постквантовой криптографии, использующие обобщенные  (l, g)-коды	Носков Иван Константинович	Беззатеев Сергей Валентинович	24.11.2023	26.12.2023	32
125762	True	07.19.00	05.27.03	Импульсно-периодический nd:yag лазер с  длиной волны излучения 946 нм	Ковяров Александр Сергеевич	Викторов Евгений Анатольевич	22.11.2019	25.12.2019	33
1035098	True	11.22.00	2.2.8	Методы и алгоритмы распознавания и классификации поверхностных дефектов листового проката на основе машинного обучения	Евстафьев Олег Александрович	Шаветов Сергей Васильевич	23.11.2023	25.12.2023	32
1025147	True	05.22.00	1.3.6	Аналого-цифровое фотограмметрическое преобразование изображений голограмм отражательного типа	Рабош Екатерина Владимировна	Петров Николай Владимирович	20.11.2023	20.12.2023	30
701428	True	08.22.00	1.3.14	Исследование процессов молекулярного переноса импульса, тепловой энергии и массы в жидких питательных средах биотехнологических производств	Сорокин Сергей Андреевич	Баранов Игорь Владимирович	11.10.2022	24.11.2022	44
233319	True	02.18.00	05.13.17	Генерация наборов данных для задачи классификации с заданными свойствами для повышения качества систем мета-обучения	Забашта Алексей Сергеевич	Фильченков Андрей Александрович	23.11.2020	24.12.2020	31
480650	True	04.19.00	2.3.5	Методы восстановления параметров сцены для решения проблемы реалистичной визуализации в системах смешанной реальности	Сорокин Максим Игоревич	Жданов Дмитрий Дмитриевич	22.11.2021	22.12.2021	30
14076039	True	09.22.00	2.7.1	Разработка синбиотического функционального ингредиента для пищевых продуктов с использованием экзополисахаридов	Курбонова Маликахон Комилжоновна	Бараненко Денис Александрович	12.11.2024	12.12.2024	30
127365	True	06.19.00	05.11.07	Стокс-поляриметр на основе двухлучевой схемы для решения задач инструментальной астрономии	Кукушкин Дмитрий Евгеньевич	Валявин Геннадий Геннадьевич	22.11.2019	23.12.2019	31
18760808	True	09.22.00	4.3.3	Совершенствование процесса и аппарата ультразвукового гидролиза кератинсодержащего сырья с использованием его в кормовых продуктах	Шанин Вячеслав Алексеевич	Алексеев Геннадий Валентинович	22.11.2024	23.12.2024	31
10316462	True	07.22.00	1.3.8	Особенности микроструктуры, упрочнения и пластичности низколегированных ультрамелкозернистых алюминиевых сплавов	Садыков Динислам Искандерович	Орлова Татьяна Сергеевна	05.11.2024	06.12.2024	31
1029222	True	09.22.00	2.7.1	Разработка технологии получения функционального  пищевого ингредиента из базидиомицета лисичка обыкновенная  (cantharellus cibarius)	Моисеенко Евгений Николаевич	Румянцева Ольга Николаевна	15.11.2023	15.12.2023	30
10316248	True	08.22.00	2.4.8	Выбор и обоснование энергоэффективного привода погружного насоса спг для крупнотоннажных накопительных хранилищ	Давыденко Мишель Игоревна	Баранов Александр Юрьевич	28.10.2024	28.11.2024	31
982117	True	09.22.00	4.3.3	Научно-практическое обоснование биоконверсии коллагенсодержащего сырья и оценка эффективности получаемых белковых компонентов в производстве мясных продуктов	Зинина Оксана Владимировна	Ребезов Максим Борисович	11.10.2023	12.12.2023	62
732170	True	05.22.00	1.3.6	Спектрально перестраиваемая лазерная генерация в свинцово-галогенидных перовскитных нитевидных микро- и нанокристаллах	Маркина Дарья Игоревна	Пушкарев Анатолий Петрович	09.11.2022	09.12.2022	30
468848	True	11.21.00	05.11.13	Разработка методики неразрушающего контроля физико-химических характеристик композиционных материалов органического происхождения	Верховская Яна Ивановна	Андреев Юрий Сергеевич	15.11.2021	16.12.2021	31
10315203	True	07.22.00	1.3.8	Численное моделирование электронных и оптических свойств каскадных и сверхмногопериодных квантовых структур для ик- и тгц-диапазонов	Дашков Александр Сергеевич	Горай Леонид Иванович	05.11.2024	06.12.2024	31
1030596	True	12.22.00	1.4.4	Синтез, физико-химические свойства и применение гибридных углеродных материалов	Навроцкая Анастасия Геннадьевна	Кривошапкина Елена Федоровна	17.11.2023	18.12.2023	31
478142	True	02.18.00	05.13.17	Метод структурирования интегрированных медицинских данных для моделирования медицинских рисков	Иванова Юлия Дмитриевна	Копаница Георгий Дмитриевич	23.11.2021	23.12.2021	30
49165329		13.22.00	5.2.3	Методы гибкого управления инновационными проектами в сфере передовых производственных технологий	Сомонов Владислав Валерьевич	Николаев Андрей Сергеевич	29.08.2025	30.09.2025	32
1035763	True	04.22.00	2.3.4	Управление эффектами коллективной динамики в клиент-ориентированных организационных системах на основе данных	Глухов Глеб Игоревич	Бухановский Александр Валерьевич	22.11.2023	22.12.2023	30
463374	True	10.19.00	05.17.06	Получение волокнистых материалов на основе гиалуроновой кислоты методом электроформования	Снетков Петр Петрович	Успенская Майя Валерьевна	25.10.2021	02.12.2021	38
246555	True	04.19.00	05.13.11	Генерация программ на основе функциональных блоков для промышленных киберфизических систем с использованием эволюционных алгоритмов	Миронович Владимир Анатольевич	Буздалов Максим Викторович	23.11.2020	23.12.2020	30
10317367	True	03.22.00	2.5.4	Алгоритмы бессенсорного управления асинхронными двигателями на основе адаптивных наблюдателей	Нгуен Куанг Кыонг	Пыркин Антон Александрович	28.10.2024	28.11.2024	31
734009	True	11.22.00	2.2.8	Разработка методики активного теплового контроля вертолётных лопастей из композиционных материалов	Котовщиков Илья Олегович	Федоров Алексей Владимирович	10.11.2022	14.12.2022	34
737512	True	05.22.00	1.3.6	Микроструктурированные волоконно-оптические элементы на основе кварцевого стекла и нанокристаллических материалов, активированных редкоземельными ионами	Матросова Александра Сергеевна	Никоноров Николай Валентинович	11.11.2022	12.12.2022	31
1032918	True	10.22.00	1.4.7	Электроактивные материалы на основе хитозана и поливинилового спирта	Ольвера Берналь Ригель Антонио	Олехнович Роман Олегович	13.11.2023	13.12.2023	30
420133	True	05.19.00	1.3.6	Эволюция оптических вихрей в дифрагированном поле	Черных Алексей Викторович	Петров Николай Владимирович	31.08.2021	06.10.2021	36
471725	True	09.19.00	05.18.07	Биотехнология получения бактериоцинов пробиотических штаммов lactobacillus helveticus и lactobacillus plantarum	Рябинин Георгий Владимирович	Бараненко Денис Александрович	19.11.2021	20.12.2021	31
180859	True	08.19.00	01.04.14	Теплофизические процессы при искровом плазменном спекании наноструктурированных термоэлектрических материалов	Тукмакова Анастасия Сергеевна	Новотельнова Анна Владимировна	06.07.2020	03.09.2020	59
10320257	True	08.22.00	1.3.14	Теплообмен при парообразовании хладагентов в ограниченном пространстве	Апицына Ольга Сергеевна	Малышев Александр Александрович	14.11.2024	19.12.2024	35
1250749	True	05.22.00	1.3.6	Лазерная модификация оптических и электрических свойств пленок pbse для устройств газового анализа	Ольхова Анастасия Александровна	Сергеев Максим Михайлович	15.07.2024	15.08.2024	31
