id	successful	dissovet	speciality	title	author	supervisor	uploaded	defended	interval
56153	True	02.18.00	05.13.17	Методы приобретения и формализации эмпирических знаний по данным медицинских информационных систем в задачах повышения качества лечения кардиологических пациентов	Мецкер Олег Геннадьевич	Ковальчук Сергей Валерьевич	26.11.2018	26.12.2018	30
244635	True	08.19.00	05.04.03	Оптимизация технических решений систем кондиционирования воздуха общественных зданий	Шилин Александр Сергеевич	Цыганков Александр Васильевич	23.11.2020	24.12.2020	31
644047	True	10.19.00	05.17.06	Разработка нановолокнистых композиционных материалов на основе поливинилхлорида методом электроформования	Ле Куок Фам	Олехнович Роман Олегович	10.06.2022	14.07.2022	34
738324	True	12.22.00	1.4.4	Межмолекулярные взаимодействия противоположно и одноименно заряженных полиэлектролитных комплексов в «умных» гибридных системах	Никитина Анна Анатольевна	Скорб Екатерина Владимировна	14.11.2022	16.12.2022	32
475955	True	06.19.00	05.11.01	Влияние задержки детектирования теплового воздействия на компенсацию дрейфа фазы саньяка в волоконно-оптическом гироскопе	Смирнов Даниил Сергеевич	Дейнека Иван Геннадьевич	29.11.2021	29.12.2021	30
1027832	True	02.22.00	1.2.1	Методы машинного обучения для сквозных систем автоматического распознавания речи	Лаптев Александр Алексеевич	Романенко Алексей Николаевич	21.11.2023	21.12.2023	30
128962	True	02.18.00	05.13.17	Система автоматического выбора и оценки алгоритмов кластеризации и их параметров	Муравьёв Сергей Борисович	Фильченков Андрей Александрович	25.11.2019	25.12.2019	30
361613	True	05.19.00	01.04.05	Конфигурирование индикатрисы рассеяния наноструктур, поддерживающих возбуждение мультипольных моментов высоких порядков	Аль-Наима Хади Карим Шамхи	Шалин Александр Сергеевич	28.05.2021	30.06.2021	33
741805	True	05.22.00	1.3.6	Влияние внешнего окружения на оптические свойства квантовых точек трехкомпонентных полупроводниковых соединений i-iii-vi	Миропольцев Максим Андреевич	Баранов Александр Васильевич	09.11.2022	09.12.2022	30
475717	True	02.18.00	05.13.17	Автоматическое распознавание эмоциональных состояний дикторов по голосовым характеристикам и тональности текста высказывания	Верхоляк Оксана Владимировна	Карпов Алексей Анатольевич	17.11.2021	17.12.2021	30
596524	True	07.19.00	1.3.8	Создание и исследование сверхкомпактных источников оптического излучения на основе туннельного контакта с локализованной оптической наноантенной	Школдин Виталий Алексеевич	Мухин Иван Сергеевич	27.05.2022	29.06.2022	33
224328	True	06.19.00	05.11.07	Исследование способов совершенствования точностных характеристик волоконно-оптической гидроакустической буксируемой косы для морских геофизических исследований	Власов Александр Андреевич	Алейник Артем Сергеевич	30.10.2020	01.12.2020	32
470701	True	01.18.00	05.13.15	Архитектура и организация граничных вычислений для виртуального кластера на основе компьютеров с ограниченными вычислительными ресурсами	Шматков Владислав Николаевич	Муромцев Дмитрий Ильич	19.11.2021	20.12.2021	31
240099	True	01.18.00	05.13.15	Архитектура и методы вычислений для распределенной сверточной нейронной сети на кластере компьютеров с ограниченными вычислительными ресурсами	Хайдарова Резеда Раитовна	Муромцев Дмитрий Ильич	18.11.2020	18.12.2020	30
1017561	True	05.22.00	1.3.4	Распространяющиеся и локализованные состояния электромагнитных волн в средах из проводов	Корешин Евгений Алексеевич	Белов Павел Александрович	15.11.2023	15.12.2023	30
246067	True	04.19.00	05.13.10	Интеллектуальные методы анализа и синтеза организационных структур для цифровой трансформации процессов разведки и разработки нефтегазовых месторождений	Буханов Никита Владимирович	Бухановский Александр Валерьевич	23.11.2020	23.12.2020	30
1036899	True	06.22.00	2.2.6	Метод лазерно-индуцированной микроплазмы при создании волоконного интерферометра маха-цендера для сенсорных применений	Цай Шухао	Петров Андрей Анатольевич	22.11.2023	25.12.2023	33
125582	True	05.19.00	01.04.05	Резонансное взаимодействие квазилинейных волн с солитонами в нелинейных световодах	Юлин Алексей Викторович	Розанов Николай Николаевич	15.01.2020	16.03.2020	61
707610	True	08.22.00	2.4.8	Анализ работы энергетической системы на базе абсорбционной бромистолитиевой холодильной машины и парогазовой установки	Байрамов Джамиль Загидович	Галимова Лариса Васильевна	27.09.2022	10.11.2022	44
14074722	True	09.22.00	4.3.3	Разработка технологии функционального пищевого продукта профилактической направленности с использованием биологически активных веществ растений семейства крестоцветные (cruciferae)	Эминова Эльмира Рамазановна	Бараненко Денис Александрович	08.11.2024	10.12.2024	32
224795	True	08.19.00	05.04.03	Анализ энергетической эффективности систем утилизации теплоты вытяжного воздуха активного типа	Муравейников Сергей Сергеевич	Сулин Александр Борисович	23.10.2020	25.11.2020	33
234139	True	06.19.00	05.11.07	Разработка беспроводной оптико-электронной системы односторонней передачи информационных сообщений с использованием светодиодов	Гареев Эмиль Зуфарович	Бугров Владислав Евгеньевич	13.11.2020	15.12.2020	32
10318514	True	14.22.00	2.3.6	Модели и методы обеспечения информационной безопасности в системе прослеживаемости товаров на основе технологии распределённого реестра	Лэ Ван Хиеу	Комаров Игорь Иванович	29.10.2024	29.11.2024	31
127097	True	07.19.00	05.27.03	Одночастотный арочный квантово-каскадный лазер диапазона 7-8 мкм на основе гетероструктур, изготовленных методом молекулярно-пучковой эпитаксии	Курочкин Александр Сергеевич	Егоров Антон Юрьевич	29.11.2019	30.12.2019	31
750831	True	02.22.00	1.2.1	Разработка средств визуального программирования для моделей машинного обучения на основе двудольного представления графа потоков данных	Ходненко Иван Владимирович	Иванов Сергей Владимирович	25.11.2022	26.12.2022	31
1028186	True	05.22.00	1.3.6	Режимы связи оптических мод в диэлектрических резонаторах	Дмитриев Алексей Андреевич	Рыбин Михаил Валерьевич	16.11.2023	18.12.2023	32
10317432	True	03.22.00	2.3.1	Синтез законов адаптивного управления для линейных нестационарных систем с неопределенностями	Та Минь Шон	Пыркин Антон Александрович	28.10.2024	28.11.2024	31
922482	True	10.22.00	1.4.7	Моделирование разветвленных пептидных молекул с гидрофобными фрагментами для доставки биоактивных олигопептидов	Фатуллаев Эмиль Илгамович	Неелов Игорь Михайлович	30.05.2023	30.06.2023	31
737919	True	09.22.00	2.7.1	Разработка технологии ферментированного напитка с пробиотическими свойствами из гречневой муки	Бучилина Алина Сергеевна	Гунькова Полина Исаевна	21.10.2022	24.11.2022	34
1033486	True	10.22.00	2.6.11	Исследование полимерных нановолокон с нанокристаллами перовскита, полученных методом электроформования	Бккар Мухаммад	Олехнович Роман Олегович	20.11.2023	20.12.2023	30
1034488	True	02.22.00	1.2.2	Математическое моделирование физико-химических процессов на основе метрических графов	Федоров Евгений Георгиевич	Попов Игорь Юрьевич	22.11.2023	22.12.2023	30
1034868	True	02.22.00	1.2.1	Математическое и программное обеспечения обучения и оценки рекомендательных систем на основе синтетических данных	Лысенко Антон Викторович	Бухановский Александр Валерьевич	24.11.2023	25.12.2023	31
571760	True	02.18.00	05.13.17	Синтез изображений лиц на основе генеративных методов машинного обучения с применением к распознаванию лиц	Зено Бассель	Матвеев Юрий Николаевич	15.04.2022	16.05.2022	31
231013	True	09.19.00	05.18.07	Разработка  состава и технологии низколактозного высобелкового замороженного десерта на козьем молоке	Лугова Маргарита Витальевна	Арсеньева Тамара Павловна	16.11.2020	17.12.2020	31
132011	True	05.19.00	01.04.05	Особенности распространения электромагнитных волн в искусственных резонансных средах на основе графена в терагерцовом диапазоне частот	Гребенчуков Александр	Ходзицкий Михаил -	23.11.2020	24.12.2020	31
757541	True	05.22.00	1.3.6	Исключительные точки в высокодобротных резонаторах с керровской нелинейностью	Рамезанпур Шахаб	Богданов Андрей Андреевич	03.02.2023	06.03.2023	31
128459	True	06.19.00	05.11.07	Разработка блока лазерного излучателя для аддитивных технологий на основе лазерных диодов непрерывного режима генерации	Котова Екатерина Ильинична	Бугров Владислав Евгеньевич	22.11.2019	30.12.2019	38
730485	True	05.22.00	1.3.6	Нелинейная генерация излучения из диэлектрических наночастиц и наноструктур	Фризюк Кристина Сергеевна	Петров Михаил Игоревич	07.11.2022	07.12.2022	30
1020127	True	01.22.00	2.3.2	Модели и методы обеспечения отказоустойчивости компьютерных систем бизнес-аналитики	Сивов Виктор Валерьевич	Богатырев Владимир Анатольевич	10.11.2023	14.12.2023	34
470608	True	06.19.00	05.11.07	Разработка и исследование высокомощных волоконных импульсных лазеров на основе активных волокон с двойной оболочкой и с переменным диаметром сердцевины	Петров Андрей Борисович	Одноблюдов Максим Анатольевич	19.11.2021	21.12.2021	32
10320335	True	07.22.00	1.3.8	Взаимодействие света с веществом в нанофотонных волноводах на основе новых функциональных материалов	Михин Алексей Олегович	Кравцов Василий Андреевич	19.11.2024	20.12.2024	31
749244	True	04.22.00	2.3.8	Метод графовой кластеризации для совместного анализа данных генотипирования и экспрессии генов	Лобода Александр Александрович	Сергушичев Алексей Александрович	22.11.2022	23.12.2022	31
1018853	True	07.22.00	1.3.11	Разработка и исследование гибридных оптоэлектронных структур на основе перовскитов галогенидных соединений, полимерных и полупроводниковых материалов	Баева Мария Григорьевна	Мухин Иван Сергеевич	02.11.2023	06.12.2023	34
726773	True	01.22.00	2.3.2	Разработка и исследование методов синтеза таблиц расписаний для сетей авионики с временным мультиплексированием	Коробков Илья Леонидович	Жаринов Игорь Олегович	07.11.2022	08.12.2022	31
14077302	True	14.22.00	2.3.6	Методы мониторинга шифрованного трафика в ip-­сетях на основе анализа цифровых отпечатков  протоколов	Ишкуватов Сергей Маратович	Комаров Игорь Иванович	20.11.2024	20.12.2024	30
10320979	True	04.22.00	2.3.8	Многомодальный контекстный анализ динамики аффективных состояний в коллаборативных группах пользователей	Дресвянский Денис Владиславович	Карпов Алексей Анатольевич	13.11.2024	13.01.2025	61
14077317	True	09.22.00	4.3.3	Разработка системного подхода к прогнозированию качества очистки сточных вод пищевых производств	Семенова Татьяна Станиславовна	Сергиенко Ольга Ивановна	18.11.2024	18.12.2024	30
454862	True	03.19.00	2.3.1	Метод синтеза адаптивных наблюдателей для нестационарных систем с полиномиальными параметрами	Данг Бинь Хак	Пыркин Антон Александрович	28.09.2021	28.10.2021	30
10306323	True	15.24.00	1.3.6	Внутрирезонаторные голографические решётки и импульсные лазеры с управляемым спектром на их основе	Погода Анастасия Павловна	Петров Виктор Михайлович	20.11.2024	21.01.2025	62
63419	True	01.18.00	05.13.12	Методы и средства автоматизированного синтеза вычислителей на основе микроархитектурных программируемых генераторов аппаратуры	Антонов Александр Александрович	Кустарев Павел Валерьевич	26.11.2018	28.12.2018	32
468855	True	06.19.00	05.11.07	Разработка компактных светосильных зеркальных систем высокого пространственного разрешения для аппаратуры дистанционного зондирования земли	Бутылкина Ксения Дмитриевна	Романова Галина Эдуардовна	19.11.2021	21.12.2021	32
236642	True	04.19.00	05.13.18	Многомасштабное моделирование и прогнозирование информационных процессов в цифровых социальных системах	Северюхина Оксана Андреевна	Боченина Клавдия Олеговна	23.11.2020	23.12.2020	30
56154	True	02.18.00	05.13.17	Адаптивные методы и технологии контроля качества гидрометеорологической информации на основе гибридных данных	Арайа Лопес Хосе Луис	Бухановский Александр Валерьевич	28.11.2018	28.12.2018	30
14075394	True	03.22.00	2.3.1	Асимптотическое оценивание параметров линейной регрессии при условии интервального возбуждения	Коротина Марина Михайловна	Бобцов Алексей Алексеевич	06.11.2024	06.12.2024	30
461441	True	08.19.00	05.04.03	Совершенствование рабочих органов винтового однороторного компрессора	Миникаев Артур Фаилевич	Пронин Владимир Александрович	12.11.2021	16.12.2021	34
226430	True	05.19.00	01.04.05	Временная динамика и спектральные свойства одиночных квантовых излучателей и их ансамблей, находящихся вблизи нанофотонных интерфейсов, с учетом хиральности взаимодействия	Корнован Данил Феодосьевич	Петров Михаил Игоревич	17.11.2020	17.12.2020	30
754054	True	04.22.00	2.3.8	Автоматическая оценка качества речевых сигналов для систем голосовой биометрии и антиспуфинга	Волкова Марина Викторовна	Новоселов Сергей Александрович	23.11.2022	23.12.2022	30
568303	True	07.19.00	1.3.19	Лазерная термохимическая запись на тонких металлических пленках с высокой разрешающей способностью	Нгуен Куанг Зунг	Шахно Елена Аркадьевна	05.05.2022	08.06.2022	34
125754	True	05.19.00	01.04.05	Управление излучением и рассеянием света при помощи плазмонных наноструктур	Гинзбург Павел Борисович	Шалин Александр Сергеевич	23.10.2020	24.12.2020	62
233148	True	03.19.00	05.02.05	Повышение эффективности мехатронных пьезоэлектрических модулей оптоэлектронных систем	Карев Павел Валерьевич	Быстров Сергей Владимирович	09.11.2020	10.12.2020	31
480474	True	07.19.00	1.3.8	Модификация вероятности спонтанной эмиссии в плазмонных, органических и полупроводниковых наноструктурах	Белоновский Алексей Владимирович	Калитеевский Михаил Алексеевич	24.11.2021	24.12.2021	30
1026102	True	01.22.00	2.3.2	Методы обеспечения надежности и энергосбережения в многопутевых программно-реконфигурируемых сетях	Данешманд Бехруз	Богатырев Владимир Анатольевич	16.11.2023	19.12.2023	33
131872	True	04.19.00	05.13.10	Математическое обеспечение управления коллаборативными процессами индустрии путешествий на основе данных социальных медиа	Мухина Ксения Дмитриевна	Бухановский Александр Валерьевич	27.11.2019	27.12.2019	30
655556	True	07.19.00	1.3.8	Интеркаляционные системы на основе графена и магнитных металлов: синтез, электронное строение и магнитные свойства	Лобанова Евгения Юрьевна	Брунков Павел Николаевич	07.06.2022	08.07.2022	31
459427	True	07.19.00	1.3.11	Рекомбинационные процессы в светодиодных структурах среднего инфракрасного диапазона	Семакова Антонина Александровна	Мынбаев Карим Джафарович	01.11.2021	01.12.2021	30
1025524	True	14.22.00	2.3.6	Методы выявления сложных атак на основании данных систем обнаружения вторжений	Павлов Артем Валерьевич	Волошина Наталия Викторовна	14.11.2023	14.12.2023	30
749581	True	07.22.00	1.3.19	Исследование процессов лазерной микропорации и доставки фотодинамических препаратов под ногтевую пластину	Козлова Анастасия Дмитриевна	Беликов Андрей Вячеславович	21.11.2022	21.12.2022	30
1020997	True	07.22.00	1.3.11	Оптоэлектронные свойства слоев одностенных углеродных нанотрубок и методы создания прозрачных текстурированных электродов на их основе	Воробьев Александр Андреевич	Мишин Максим Валерьевич	10.11.2023	13.12.2023	33
1013939	True	07.22.00	1.3.8	Метод получения, структура и фотокаталитические свойства нано- и микрообъектов zno	Соснин Илья Михайлович	Романов Алексей Евгеньевич	02.11.2023	06.12.2023	34
127889	True	02.18.00	05.13.19	Методы обнаружения и противодействия автоматизированному сбору информации с веб-ресурсов	Менщиков Александр Алексеевич	Гатчин Юрий Арменакович	11.11.2019	11.12.2019	30
735917	True	05.22.00	1.3.6	Метод лазерно-индуцированной микроплазмы для формирования оптических элементов	Рымкевич Владимир Сергеевич	Сергеев Максим Михайлович	16.11.2022	20.12.2022	34
231035	True	02.18.00	05.13.17	Построение полярных подкодов и упрощённые методы их кодирования и декодирования	Морозов Руслан Александрович	Трифонов Пётр Владимирович	13.11.2020	15.12.2020	32
