id	successful	dissovet	speciality	title	author	supervisor	uploaded	defended	interval
230906	True	05.19.00	01.04.03	Исследование фотонных топологических изоляторов на основе диэлектрических структур в микроволновом частотном диапазоне	Жирихин Дмитрий Васильевич	Слобожанюк Алексей Петрович	13.11.2020	15.12.2020	32
472204	True	09.19.00	05.18.07	Исследование функционально-технологических свойств ресвератрола и его применение для обогащения продуктов питания	Солодовникова Малика Саяфатовна	Баланов Петр Евгеньевич	19.11.2021	20.12.2021	31
229062	True	06.19.00	05.11.07	Формирование и анализ изображений микроструктуры объектов в оптической когерентной томографии с перестраиваемой длиной волны и линейным полем освещения	Пименов Алексей Юрьевич	Гуров Игорь Петрович	15.06.2021	12.10.2021	119
306521	True	04.19.00	05.13.11	Разработка и исследование алгоритмов устранения визуальной избыточности на основе кодирующих преобразований	Доан Бан Тиен	Тропченко Андрей Александрович	26.03.2021	27.04.2021	32
745504	True	06.22.00	2.2.6	Исследование метода комплексирования изображений в оптико-электронном комплексе для эрозионного контроля лопаточного аппарата паровых турбин	Ахмеров Артём Харисович	Васильев Александр Сергеевич	18.11.2022	20.12.2022	32
646890	True	05.19.00	1.3.4	Разрушение симметрии эффективного потенциала в мультипольных радиочастотных ловушках	Рудый Семён Сергеевич	Рождественский Юрий Владимирович	29.07.2022	30.08.2022	32
757521	True	06.22.00	2.2.6	Разработка метода контроля составного зеркала телескопа	Сечак Евгений Николаевич	Демин Анатолий Владимирович	25.11.2022	26.12.2022	31
1025237	True	06.22.00	2.2.6	Методы восстановления оптических свойств светорассеивающих материалов	Соколов Вадим Геннадьевич	Потемин Игорь Станиславович	07.11.2023	07.12.2023	30
435076	True	02.18.00	05.13.17	Метод диаграмматической верификации онтологий на основе дескрипционной логики alc	Нгуен Нгок Тхан	Баймуратов Ильдар Раисович	24.09.2021	26.10.2021	32
180925	True	08.19.00	05.04.03	Анализ   эффективности холодильных систем с радиационным охлаждением в зависимости от климатических условий	Цой Диана Александровна	Бараненко Александр Владимирович	30.07.2020	28.10.2020	90
230313	True	05.19.00	01.04.05	Люминесцентные и фотоэлектрические свойства гибридных структур на основе наноструктурированного углерода и квантовых полупроводниковых нанокристаллов	Резник Иван Алексеевич	Орлова Анна Олеговна	03.11.2020	07.12.2020	34
236664	True	03.19.00	05.13.01	Синтез адаптивного   управления   линейными   системами по выходной  переменной  на  базе  алгоритмов  адаптации с улучшенной сходимостью	Беляев Михаил Евгеньевич	Герасимов Дмитрий Николаевич	16.11.2020	17.12.2020	31
10319507	True	06.22.00	2.2.6	Метод формирования волоконных устройств на основе явления движущегося оптического разряда	Конин Юрий Александрович	Петров Андрей Анатольевич	11.11.2024	12.12.2024	31
206708	True	04.19.00	05.13.11	Технология интеллектуальной организации процесса выполнения неоднородных композитных приложений в глобальной вычислительной среде	Мельник Михаил Алексеевич	Насонов Денис Александрович	30.10.2020	30.11.2020	31
236582	True	05.19.00	01.04.05	Влияние фотоактиничного излучения на структуру и свойства молекулярных со-кристаллов аминопиридинового ряда	Жевайкин Кирилл Евгеньевич	Фокина Мария Ивановна	20.11.2020	21.12.2020	31
235276	True	04.19.00	05.13.11	Методы и алгоритмы эффективной визуализации моделей трехмерных сцен на многопроцессорных рабочих станциях	Жданов Андрей Дмитриевич	Жданов Дмитрий Дмитриевич	20.11.2020	21.12.2020	31
18764947	True	07.22.00	1.3.8	Улучшение структурной стабильности и оптических свойств тонких пленок и микродисков на основе галогенидных перовскитов	Татаринов Дмитрий Андреевич	Пушкарев Анатолий Петрович	28.01.2025	28.02.2025	31
734443	True	11.22.00	2.2.8	Совершенствование методов и алгоритмов математической обработки спектральных данных в исследованиях биологических материалов	Бойченко Екатерина Сергеевна	Кирсанов Дмитрий Олегович	10.11.2022	14.12.2022	34
14075970	True	12.22.00	1.4.4	Механизмы супрамолекулярных сборок азотсодержащих гетероциклов и создание фотоактивных систем на их основе	Тимралиева Александра Акбулатовна	Скорб Екатерина Владимировна	19.11.2024	19.12.2024	30
224312	True	05.19.00	01.04.05	Создание фотонных структур методом лазерной литографии и их спектроскопические исследования	Синельник Артем Дмитриевич	Лимонов Михаил Феликсович	02.11.2020	03.12.2020	31
124815	True	10.19.00	05.17.06	Создание акриловых гидрогелевых сорбентов для повышения урожайности почв	Байдакова Марина Викторовна	Успенская Майя Валерьевна	18.11.2019	19.12.2019	31
473294	True	05.19.00	1.3.6	Оптические резонансы в наноструктурах для модифицирования радиационной рекомбинации в галогенидных перовскитах	Берестенников Александр Сергеевич	Макаров Сергей Владимирович	19.11.2021	20.12.2021	31
126148	True	05.19.00	01.04.05	Исследование структурно-люминесцентных свойств синтетических микро- и наноалмазов методами рамановской и люминесцентной спектроскопии	Рунова Марианна Васильевна	Баранов Александр Васильевич	01.11.2019	19.12.2019	48
230535	True	07.19.00	01.04.10	Исследование свойств эпитаксиальных пленок и объемных кристаллов нитрида и оксида галлия для создания приборов силовой электроники	Кремлева Арина Валерьевна	Бугров Владислав Евгеньевич	30.10.2020	02.12.2020	33
229485	True	08.19.00	05.04.03	Исследование процессов вакуумно-испарительной кристаллизации при получении бинарного льда	Тазитдинов Рамиль	Коченков Николай Викторович	23.11.2020	24.12.2020	31
1019753	True	11.22.00	2.2.8	Разработка методики акустического неразрушающего контроля остаточных напряжений в специальных трубах	Алифанова Ирина Евгеньевна	Кинжагулов Игорь Юрьевич	31.10.2023	06.12.2023	36
126038	True	05.19.00	01.04.05	Круговой дихроизм поглощения света хиральными полупроводниковыми наноструктурами с винтовой симметрией	Перезябова Татьяна Павловна	Федоров Анатолий Валентинович	01.11.2019	19.12.2019	48
18756260	True	16.24.00	1.3.4	Неотражающие метаповерхности для преобразования пространственного спектра	Тумашов Максим Александрович	Глыбовский Станислав Борисович	20.11.2024	20.12.2024	30
517139	True	06.19.00	05.11.07	Разработка компенсаторов волнового фронта на основе поверхностей свободной формы для контроля асферических зеркал	Мазур Яна Вадимовна	Вознесенская Анна Олеговна	28.01.2022	28.02.2022	31
358403	True	06.19.00	05.11.07	Оптико-электронное устройство формирования динамического визуального изображения  для целей светотерапии	Сапунова Наталия Петровна	Прокопенко Виктор Трофимович	01.07.2021	12.10.2021	103
454835	True	11.21.00	05.11.13	Разработка системы мониторинга и нейтрализации выхлопных газов двигателей внутреннего сгорания в местах их настройки, обкатки и регулировки	Гхеллаб Яхья	Андреев Юрий Сергеевич	15.11.2021	15.12.2021	30
470040	True	06.19.00	05.11.01	Повышение частотной стабильности одномодового вертикально-излучающего лазера спектрального диапазона 1,55 мкм с использованием дополнительного поляризационно-чувствительного внешнего резонатора на основе волоконной решетки брэгга	Шулепов Владимир Андреевич	Аксарин Станислав Михайлович	24.11.2021	24.12.2021	30
472401	True	11.21.00	05.11.14	Разработка автоматизированной технологии изготовления трубчатых трансформируемых элементов из термопластичных композиционных материалов	Ювшин Александр Михайлович	Андреев Юрий Сергеевич	16.11.2021	17.12.2021	31
745224	True	03.22.00	2.5.4	Исследование и разработка системы управления ветроэнергетической установкой на эффекте магнуса	Лукин Александр Евгеньевич	Демидова Галина Львовна	22.11.2022	23.12.2022	31
745063	True	05.22.00	1.3.6	Оптические и спектрально-люминесцентные свойства серебряных ионообменных слоёв силикатных стекол, активированных редкоземельными ионами и галогенидами	Марасанов Дмитрий Вячеславович	Никоноров Николай Валентинович	16.11.2022	16.12.2022	30
726605	True	09.22.00	4.3.3	Разработка технологических решений для производства мясных рубленых полуфабрикатов из сырья животного и растительного происхождения с заданными качественными характеристиками	Мирошник Алексей Сергеевич	Ишевский Александр Леонидович	17.10.2022	17.11.2022	31
737658	True	05.22.00	1.3.6	Взаимодействие лазерного излучения с гибридными высокоиерархичными структурами	Миличко Валентин Андреевич	Белов Павел Александрович	15.03.2023	16.05.2023	62
476377	True	04.19.00	2.3.4	Интеллектуальная поддержка принятия решений для предупреждения поллинозов на основе автоматического распознавания изображений пыльцы	Ханжина Наталья Евгеньевна	Фильченков Андрей Александрович	19.11.2021	24.12.2021	35
228844	True	02.18.00	05.13.17	Методы обобщения и повышения производительности двухфазного генетического алгоритма со скрещиванием, компенсирующим воздействия мутаций	Басин Антон	Буздалов Максим Викторович	18.11.2020	18.12.2020	30
49122721		04.22.00	2.3.8	Методы классификации объектов в виде наборов строковых данных с применением графов де брейна	Иванов Артем Борисович	Ульянцев Владимир Игоревич	02.07.2025	24.10.2025	114
129138	True	02.18.00	05.13.17	Автоматическое чтение по губам с помощью lipsid-признаков	Главач Мирослав	Карпов Алексей Анатольевич	19.11.2019	19.12.2019	30
14074965	True	14.22.00	2.3.6	Анализ рисков нарушения информационной безопасности в индустриальных автоматизированных информационных системах	Асфха Амануэль Эстифанос	Заколдаев Данил Анатольевич	22.11.2024	24.12.2024	32
1032079	True	02.22.00	1.2.2	Методы построения моделей демографических историй	Носкова Екатерина Эдуардовна	Ульянцев Владимир Игоревич	22.11.2023	22.12.2023	30
431099	True	09.19.00	05.18.07	Разработка технологии функционального напитка адаптогенного действия для восстановления организма после алкогольной интоксикации	Хасанов Артур Раильевич	Баракова Надежда Васильевна	15.10.2021	17.11.2021	33
739787	True	11.22.00	2.2.8	Разработка методики акустико-эмиссионного контроля металлических изделий аддитивного производства	Ковалевич Анастасия Сергеевна	Кинжагулов Игорь Юрьевич	18.11.2022	21.12.2022	33
125370	True	05.19.00	01.04.05	Оптические волны в неэрмитовых системах с антилинейными симметриями	Зезюлин Дмитрий Александрович	Жаров Александр Александрович	18.10.2019	20.12.2019	63
915916	True	09.22.00	4.3.3	Ресурсосберегающая технология обезжиренного йогурта, обогащенного биологически активными веществами финиковых косточек в инкапсулированной форме	Хашим Махмуд Ахмед Мохиелдин Абделгвад	Надточий Людмила Анатольевна	29.05.2023	29.06.2023	31
129488	True	01.18.00	05.13.15	Методы и алгоритмы автоматического масштабирования облачных систем с нестационарной нагрузкой	Жмылёв Сергей Александрович	Алиев Тауфик Измайлович	27.11.2019	27.12.2019	30
475021	True	04.19.00	2.3.5	Система управления базами знаний для управления процессами интеллектуального анализа данных	Мань Тяньсин	Жукова Наталия Александровна	19.11.2021	22.12.2021	33
240850	True	08.19.00	01.04.14	Исследование теплофизических свойств фруктов юго-восточной азии	Ай Тун	Баранов Игорь Владимирович	25.05.2021	30.06.2021	36
125706	True	02.18.00	05.13.19	Методы повышения безопасности комбинированных схем аутентификации	Комарова Антонина Владиславовна	Коробейников Анатолий Григорьевич	11.11.2019	11.12.2019	30
745450	True	06.22.00	2.2.4	Волоконно-оптические датчики физических величин на базе специальных структур волоконных брэгговских решеток, работающие на основе измерения мощности отраженного оптического сигнала	Дмитриев Андрей Анатольевич	Варжель Сергей Владимирович	16.11.2022	16.12.2022	30
211340	True	08.19.00	01.04.14	Исследование переноса теплоты в устройстве для общего криотерапевтического воздействия	Ережеп Дархан	Баранов Александр Юрьевич	30.07.2020	03.09.2020	35
1126722	True	09.22.00	4.3.3	Совершенствование технологии производства мясных и рыбных колбасных изделий, обогащенных омега-3 полиненасыщенными жирными кислотами и пробиотиками	Глухарев Андрей Юрьевич	Волченко Василий Игоревич	23.04.2024	24.05.2024	31
1029027	True	07.22.00	1.3.19	Генераторы случайных чисел на основе низкоразмерных полупроводниковых гетероструктур	Петренко Артем Александрович	Ковалев Антон Владимирович	15.11.2023	20.12.2023	35
428667	True	05.19.00	1.3.6	Исследование энергетической структуры углеродных наночастиц в растворах и твердотельных матрицах	Степаниденко Евгения Александровна	Ушакова Елена Владимировна	28.09.2021	28.10.2021	30
229185	True	05.19.00	01.04.05	Исследование оптических свойств малоатомных металлических кластеров и плазмонных наночастиц в тонких диэлектрических пленках	Гладских Полина Владимировна	Вартанян Тигран Арменакович	13.11.2020	15.12.2020	32
1032577	True	06.22.00	2.2.6	Разработка зеркального модуля интегрального поля для астрономических спектрометров	Орехова Мария Кирилловна	Бахолдин Алексей Валентинович	13.11.2023	14.12.2023	31
10316201	True	08.22.00	1.3.14	Исследование теплофизических процессов в двумерных наноматериалах на основе висмута и сурьмы при воздействии терагерцового излучения	Демченко Пётр Сергеевич	Новотельнова Анна Владимировна	08.11.2024	12.12.2024	34
56152	True	02.18.00	05.13.19	Методы и комплекс программных средств детектирования атак с целью взлома голосовых биометрических систем	Лаврентьева Галина Михайловна	Матвеев Юрий Николаевич	14.11.2018	14.12.2018	30
42099015	True	13.22.00	5.2.3	Методика управления цифровыми инновациями в организации на основе процессного подхода	Шабан Антон Павлович	Силкина Галина Юрьевна	17.03.2025	17.04.2025	31
641816	True	02.18.00	05.13.19	Методы и алгоритмы построения устойчивых распределенных реестров с использованием многомерного блокчейна	Шилов Илья Михайлович	Заколдаев Данил Анатольевич	03.06.2022	05.07.2022	32
128647	True	05.19.00	01.04.05	Устойчивость квантовых систем передачи информации на боковых частотах к воздействию нелегитимного пользователя на измерительное оборудование	Чистяков Владимир Викторович	Глейм Артур Викторович	25.11.2019	26.12.2019	31
129175	True	02.18.00	05.13.17	Метод и алгоритмы создания онтологий на основе анализа метаданных и контекста слабоструктурированного контента	Волчек Дмитрий Геннадьевич	Муромцев Дмитрий Ильич	23.11.2019	23.12.2019	30
728686	True	07.22.00	1.3.11	Формирование и исследование свойств iii-n квазиодномерных кристаллов и создание оптоэлектронных приборов на их основе	Котляр Константин Павлович	Сошников Илья Петрович	21.10.2022	23.11.2022	33
211796	True	02.18.00	05.13.17	Методы и алгоритмы штрихового кодирования для задач лицевой биометрии	Казиева Назым	Кухарев Георгий Александрович	25.08.2020	25.09.2020	31
1025520	True	03.22.00	2.3.1	Робастное управление ограниченными по входу динамическими системами с неопределенностями	Каканов Михаил Александрович	Борисов Олег Игоревич	07.11.2023	07.12.2023	30
139268	True	05.19.00	01.04.05	Трехмерные нелинейно-оптические структуры с фазовой квазисинхронизацией: теоретический анализ, синтез материала и методы изготовления на полимерной основе	Погосян Тамара Николаевна	Денисюк Игорь Юрьевич	17.01.2020	18.02.2020	32
10315229	True	15.24.00	2.2.7	Исследование фотокаталитических и структурных свойств композитов на основе оксида цинка, модифицированных диоксидом олова и оксидом железа	Хомутинникова Лариса Львовна	Мешковский Игорь Касьянович	02.11.2024	04.12.2024	32
1021205	True	06.22.00	2.2.4	Разработка и исследование метода измерения характеристик потока газожидкостной смеси на основе волоконных дифракционных структур и волоконного нагревательного элемента	Клишина Виктория Александровна	Варжель Сергей Владимирович	27.10.2023	30.11.2023	34
